{"error_id":"error-scw-001","error_class":"AUTHORITY","severity":"ERROR","recoverability":"HUMAN_REQUIRED","stop_reason":"Push approval is missing","root_cause":"Commit approval does not authorize push","missing_input":"Active PUSH approval reference","resume_condition":"Human approves push for verified commit and remote","retry_allowed":false,"retry_after":null,"human_decision_required":true,"related_artifact_id":"artifact-completion-001","related_event_id":null,"related_effect_id":"effect-push-001","evidence_references":["receipt-commit-001"]}
